### ISSUE TITLE
User credentials are all correct.But server response  PJSIP_SC_UNAUTHORIZED

### ISSUE THREAD

**Issue by vipinkviswanath** [VoiSmart/pjsip-android#74]
Credentials
id=name@exmaple.com:5464
username=name
realm =example.com
host= example.com
port=5464
tcpenabled=false

**Comment by aenonGit** [comment]
meybe the server requires further authentication. Show me code and logs pls

**Comment by vipinkviswanath** [comment]
@aenonGit 
//SipAccountData

    public static final String AUTH_TYPE_DIGEST = "digest";
    public static final String AUTH_TYPE_PLAIN = "plain";

    private String username="user";
    private String password="psd";
    private String realm="abc.xyz.com";
    private String host="abc.xyz.com";
    private String contactUriParams="";
    private long port = 5363;
    private boolean tcpTransport = false;
    private String authenticationType =AUTH_TYPE_DIGEST;
    private int regExpirationTimeout =300;     // 300s
    private String guestDisplayName ="";

**************
//Login()

    SipAccountData SAccData = new SipAccountData();
    SipServiceCommand.setAccount(this,SAccData);

**************


  

2019-05-29 13:31:36.847 13580-13665 D/SipService: Creating SipService with priority: 10
2019-05-29 13:31:36.850 13580-13665 D/SipService: OpenH264 loaded
2019-05-29 13:31:36.854 13580-13665 D/SipService: PJSIP pjsua2 loaded
2019-05-29 13:31:36.858 13580-13665 D/SipService: SipService created!
2019-05-29 13:31:36.859 13580-13665 D/SipService: Removing all the configured accounts
2019-05-29 13:31:36.915 13580-13665 D/SipService: Adding sip:user@abc.xyz.com
2019-05-29 13:31:36.915 13580-13665 D/SipService: Starting PJSIP
2019-05-29 13:31:37.431 13580-13665 D/SipService: PJSIP started!
2019-05-29 13:31:37.437 13580-13580 D/SipServiceBR: SIP service stack started
2019-05-29 13:31:38.113 13580-13665 D/SipService: SIP account sip:user@abc.xyz.com successfully added
2019-05-29 13:32:10.140 13580-13580 D/SipServiceBR: onRegistration - accountID: sip:user@abc.xyz.com, registrationStateCode: PJSIP_SC_UNAUTHORIZED

**Comment by aenonGit** [comment]
sip trace? you can use simple tools like wireshark/sngrep to catch that. Normally it would be ok to receive the unauthorized because after that the server sends a nonce with gets resolved by pjsip and resent along a new registration msg

**Comment by vipinkviswanath** [comment]
@aenonGit 
Any problem with encoding?My password contains @.

**Comment by aenonGit** [comment]
mmm you know that it might be it! But it should also depend on how your server handles the encoding. Can you change it to see if that's the case? Maybe using only chars and numbers

**Comment by vipinkviswanath** [comment]
changed password and tried.But not registering.
The same account is working in Zoiper(only with username,password and host,no other credentials).
Any other suggestion?

**Comment by aenonGit** [comment]
is it a typo or the port used in the first post differs from the one in the third post?

besides that, could you provide me some sip trace and how you set the sipAccount?

**Comment by vipinkviswanath** [comment]
no typo.The port in first post was just an example.

**Comment by vipinkviswanath** [comment]
Another case:
I also tried with onsip account.Have you ever tried?
I registered user@something.onsip.com  with its password in zoiper.But the same having PJSIP_SC_REQUEST_TIMEOUT in our app.

**Comment by aenonGit** [comment]
you could see what changes between the two REGISTER, the one sent by your app and the one sent by zoiper. There must be something different. From there we can start debugging

**Comment by vipinkviswanath** [comment]
@aenonGit 
09:17:59.862944 IP IP.49658 > IP.vultr.com.5363: UDP, length 596
E..p..@.3....a.[-M.......\..REGISTER sip:user@abc.xyz.com:5363 SIP/2.0
Via: SIP/2.0/UDP IP:49658;rport;branch=z9hG4bKPjafb3c57c-08fc-48b8-8e41-e9884dab0f4a
Route: <sip:user@abc.xyz.com:5363;lr>
Max-Forwards: 70
From: <sip:user@abc.xyz.com>;tag=b17f5dab-56f6-42bd-9d56-a2dae31bc489
To: <sip:user@abc.xyz.com>
Call-ID: a76aa8aaee710aef5a431e363445dcb8
CSeq: 37852 REGISTER
User-Agent: AndroidSipService/1
Contact: <sip:user@IP:49658;ob>
Expires: 300
Allow: PRACK, INVITE, ACK, BYE, CANCEL, UPDATE, INFO, SUBSCRIBE, NOTIFY, REFER, MESSAGE, OPTIONS
Content-Length:  0


09:17:59.864749 IP IP.vultr.com.5363 > IP.49658: UDP, length 576
E`.\I.@.@...-M...a.[.....H.!SIP/2.0 401 Unauthorized
Via: SIP/2.0/UDP IP:49658;rport=49658;received=27.97.211.91;branch=z9hG4bKPjafb3c57c-08fc-48b8-8e41-e9884dab0f4a
Call-ID: a76aa8aaee710aef5a431e363445dcb8
From: <sip:user@abc.xyz.com>;tag=b17f5dab-56f6-42bd-9d56-a2dae31bc489
To: <sip:user@abc.xyz.com>;tag=z9hG4bKPjafb3c57c-08fc-48b8-8e41-e9884dab0f4a
CSeq: 37852 REGISTER
WWW-Authenticate: Digest  realm="asterisk",nonce="1559294279/d81aa47cb0ba9fc6d3b36f497e97cbe3",opaque="396c29b2153c9ecf",algorithm=md5,qop="auth"
Server: FPBX-14.0.11(13.18.3)
Content-Length:  0

**Comment by vipinkviswanath** [comment]
09:17:59.862944 IP IP.49658 > IP.vultr.com.5363: UDP, length 596
E..p..@.3....a.[-M.......\..REGISTER sip:user@abc.xyz.com:5363 SIP/2.0
Via: SIP/2.0/UDP IP:49658;rport;branch=z9hG4bKPjafb3c57c-08fc-48b8-8e41-e9884dab0f4a
Route: <sip:user@abc.xyz.com:5363;lr>
Max-Forwards: 70
From: <sip:user@abc.xyz.com>;tag=b17f5dab-56f6-42bd-9d56-a2dae31bc489
To: <sip:user@abc.xyz.com>
Call-ID: a76aa8aaee710aef5a431e363445dcb8
CSeq: 37852 REGISTER
User-Agent: AndroidSipService/1
Contact: <sip:user@IP:49658;ob>
Expires: 300
Allow: PRACK, INVITE, ACK, BYE, CANCEL, UPDATE, INFO, SUBSCRIBE, NOTIFY, REFER, MESSAGE, OPTIONS
Content-Length:  0


09:17:59.864749 IP IP.vultr.com.5363 > IP.49658: UDP, length 576
E`.\I.@.@...-M...a.[.....H.!SIP/2.0 401 Unauthorized
Via: SIP/2.0/UDP IP:49658;rport=49658;received=IP;branch=z9hG4bKPjafb3c57c-08fc-48b8-8e41-e9884dab0f4a
Call-ID: a76aa8aaee710aef5a431e363445dcb8
From: <sip:user@abc.xyz.com>;tag=b17f5dab-56f6-42bd-9d56-a2dae31bc489
To: <sip:user@abc.xyz.com>;tag=z9hG4bKPjafb3c57c-08fc-48b8-8e41-e9884dab0f4a
CSeq: 37852 REGISTER
WWW-Authenticate: Digest  realm="asterisk",nonce="1559294279/d81aa47cb0ba9fc6d3b36f497e97cbe3",opaque="396c29b2153c9ecf",algorithm=md5,qop="auth"
Server: FPBX-14.0.11(13.18.3)
Content-Length:  0

**Comment by aenonGit** [comment]
mmm something related to [this](https://community.asterisk.org/t/solved-no-authorization-in-register-with-pjsip/47501)

**Comment by Huu-Thai** [comment]
> @aenonGit
> 
> server response for request from my application
> 
> ```
> 09:17:59.862944 IP IP.49658 > IP.vultr.com.5363: UDP, length 596
> E..p..@.3....a.[-M.......\..REGISTER sip:user@abc.xyz.com:5363 SIP/2.0
> Via: SIP/2.0/UDP IP:49658;rport;branch=z9hG4bKPjafb3c57c-08fc-48b8-8e41-e9884dab0f4a
> Route: <sip:user@abc.xyz.com:5363;lr>
> Max-Forwards: 70
> From: <sip:user@abc.xyz.com>;tag=b17f5dab-56f6-42bd-9d56-a2dae31bc489
> To: <sip:user@abc.xyz.com>
> Call-ID: a76aa8aaee710aef5a431e363445dcb8
> CSeq: 37852 REGISTER
> User-Agent: AndroidSipService/1
> Contact: <sip:user@IP:49658;ob>
> Expires: 300
> Allow: PRACK, INVITE, ACK, BYE, CANCEL, UPDATE, INFO, SUBSCRIBE, NOTIFY, REFER, MESSAGE, OPTIONS
> Content-Length:  0
> ```
> 
> ```
> 09:17:59.864749 IP IP.vultr.com.5363 > IP.49658: UDP, length 576
> E`.\I.@.@...-M...a.[.....H.!SIP/2.0 401 Unauthorized
> Via: SIP/2.0/UDP IP:49658;rport=49658;received=IP;branch=z9hG4bKPjafb3c57c-08fc-48b8-8e41-e9884dab0f4a
> Call-ID: a76aa8aaee710aef5a431e363445dcb8
> From: <sip:user@abc.xyz.com>;tag=b17f5dab-56f6-42bd-9d56-a2dae31bc489
> To: <sip:user@abc.xyz.com>;tag=z9hG4bKPjafb3c57c-08fc-48b8-8e41-e9884dab0f4a
> CSeq: 37852 REGISTER
> WWW-Authenticate: Digest  realm="asterisk",nonce="1559294279/d81aa47cb0ba9fc6d3b36f497e97cbe3",opaque="396c29b2153c9ecf",algorithm=md5,qop="auth"
> Server: FPBX-14.0.11(13.18.3)
> Content-Length:  0
> ```
> 
> response of server for same account from zoiper
> 
> ```
> 09:21:56.835515 IP IP.52751 > IP.vultr.com.5363: UDP, length 901
> E...g,@.3..X.a.[-M..........REGISTER sip:user@abc.xyz.com:5363;transport=UDP SIP/2.0
> Via: SIP/2.0/UDP IP:52751;branch=z9hG4bK-524287-1---f99e779888df7467;rport
> Max-Forwards: 70
> Contact: <sip:user@IP:52751;transport=UDP;rinstance=ad7607c9d7c09e5f>
> To: <sip:user@abc.xyz.com:5363;transport=UDP>
> From: <sip:user@abc.xyz.com:5363;transport=UDP>;tag=c656415f
> Call-ID: 0glCJKj1yyIw0hUcHIJHpQ..
> CSeq: 2 REGISTER
> Expires: 60
> Allow: INVITE, ACK, CANCEL, BYE, NOTIFY, REFER, MESSAGE, OPTIONS, INFO, SUBSCRIBE
> User-Agent: Zoiper rv2.9.2
> Authorization: Digest username="user",realm="asterisk",nonce="1559294516/1e719a4e3631d337dfde5fc86c122032",uri="sip:user@abc.xyz.com:5363;transport=UDP",response=
> "385155c01e7a5f027dff1af0ed6eff28",cnonce="457c7e62d7d4e6e8c1c3dcad3e770f73",nc=00000001,qop=auth,algorithm=md5,opaque="58b32ab708258b11"
> Allow-Events: presence, kpml, talk
> Content-Length: 0
> ```
> 
> ```
> 09:21:56.837114 IP IP.189.vultr.com.5363 > IP.52751: UDP, length 489
> E`..~O@.@..q-M...a.[........SIP/2.0 200 OK
> Via: SIP/2.0/UDP IP:52751;rport=52751;received=IP;branch=z9hG4bK-524287-1---f99e779888df7467
> Call-ID: 0glCJKj1yyIw0hUcHIJHpQ..
> From: <sip:user@abc.xyz.com>;tag=c656415f
> To: <sip:user@abc.xyz.com>;tag=z9hG4bK-524287-1---f99e779888df7467
> CSeq: 2 REGISTER
> Date: Fri, 31 May 2019 09:21:56 GMT
> Contact: <sip:user@IP:52751;rinstance=ad7607c9d7c09e5f>;expires=59
> Expires: 60
> Server: FPBX-14.0.11(13.18.3)
> Content-Length:  0
> ```

did you solve it ? please help me

**Comment by zackbugti** [comment]
[Help me urgently, its so urgent please please please]
@aenonGit Sir please help me out too. I have downloaded this whole package and built, but it isn't running and I am facing difficulty understanding the code. So please help me out how to make an application based on this. I need to develop just a simple application that could send/receive messages and calls. Please help me.

**Comment by zackbugti** [comment]
@Huu-Thai  Help me please, if u can.

**Comment by zackbugti** [comment]
Please somebody help me too. I need to develop an application based on sipservice.

**Comment by fukemy** [comment]
hi, did u solved this? I got same issues, can not register account even success register in ios with same information

**Comment by aenonGit** [comment]
closing due to inactivity
